{
  "schema": "qtcn-seed/v1",
  "engine": "freecad",
  "product": {
    "code": "TEST-01",
    "name": "fixture-good",
    "units": "mm",
    "principal_particulars": {"envelope_mm": {"L": 1000, "W": 500, "H": 200}},
    "total_mass_kg": 31.4
  },
  "source": {"file": "C:/x/test.step", "objects": 6, "solid_parts": 5},
  "bom": [
    {
      "vt": "VT1", "pos": 1, "drawing_no": null, "name": "Nẹp dọc", "qty": 4,
      "material": "Thép EH32",
      "specs": {
        "est_mass_kg": 3.925, "total_mass_kg": 15.7, "volume_cm3": 500.0,
        "area_cm2": 1700.0, "bbox_mm": {"x": 1000, "y": 40, "z": 40},
        "density_g_cm3": 7.85, "density_assumed": false, "material_source": "label",
        "sections": [], "plate_mm": null, "tolerances": [], "key_dims": [], "sheets": []
      }
    },
    {
      "vt": "VT2", "pos": 2, "drawing_no": null, "name": "Tấm đáy", "qty": 1,
      "material": "Thép EH32",
      "specs": {
        "est_mass_kg": 15.7, "total_mass_kg": 15.7, "volume_cm3": 2000.0,
        "area_cm2": 10150.0, "bbox_mm": {"x": 1000, "y": 500, "z": 5},
        "density_g_cm3": 7.85, "density_assumed": false, "material_source": "label",
        "sections": [], "plate_mm": "5", "tolerances": [], "key_dims": [], "sheets": []
      }
    }
  ],
  "consumables": [], "relationships": [],
  "flags": {"from_3d_solids": true}
}
