{
  "schema": "qtcn-seed/v1",
  "engine": "freecad",
  "freecad_version": "1.1.1",
  "product": {
    "code": null,
    "name": "actual-seed",
    "type": null,
    "units": "mm",
    "principal_particulars": {
      "envelope_mm": {
        "L": 140.0,
        "W": 40.0,
        "H": 1000.0
      }
    },
    "total_mass_kg": 18.84
  },
  "source": {
    "file": "d:\\KN-Stack\\golden\\step\\frame-varies\\source\\ThanhGocX2.step",
    "objects": 11,
    "solid_parts": 2
  },
  "bom": [
    {
      "vt": "VT1",
      "pos": 1,
      "drawing_no": null,
      "name": "ThanhGoc",
      "qty": 2,
      "material": "Thép EH32",
      "specs": {
        "sections": [],
        "plate_mm": null,
        "tolerances": [],
        "key_dims": [],
        "est_mass_kg": 6.28,
        "total_mass_kg": 18.84,
        "mass_varies": true,
        "bbox_mm": {
          "x": 40.0,
          "y": 40.0,
          "z": 500.0
        },
        "volume_cm3": 800.0,
        "area_cm2": 832.0,
        "density_g_cm3": 7.85,
        "density_assumed": true,
        "material_source": "default",
        "sheets": [],
        "unit_mass_range_kg": [
          6.28,
          12.56
        ]
      }
    }
  ],
  "consumables": [],
  "relationships": [],
  "flags": {
    "from_3d_solids": true,
    "some_density_assumed": true,
    "material_sources": {
      "label": 0,
      "name_rule": 0,
      "default": 1
    }
  },
  "_note": "Nền tảng cho qtcn (--seed). est_mass_kg là KHỐI LƯỢNG THẬT từ solid 3D. VT gán tự động; drawing_no/consumables/relationships để trống (điền tay/gộp seed 2D)."
}