{
  "schema": "qtcn-seed/v1",
  "engine": "freecad",
  "freecad_version": "1.1.1",
  "product": {
    "code": null,
    "name": "actual-seed",
    "type": null,
    "units": "mm",
    "principal_particulars": {
      "envelope_mm": {
        "L": 100.0,
        "W": 100.0,
        "H": 200.0
      }
    },
    "total_mass_kg": 12.331
  },
  "source": {
    "file": "d:\\KN-Stack\\cad-pipeline\\golden\\step\\cylinder\\source\\TruDac.step",
    "objects": 1,
    "solid_parts": 1
  },
  "bom": [
    {
      "vt": "VT1",
      "pos": 1,
      "drawing_no": null,
      "name": "TruDac",
      "qty": 1,
      "material": "Thép EH32",
      "specs": {
        "sections": [],
        "plate_mm": null,
        "tolerances": [],
        "key_dims": [],
        "est_mass_kg": 12.331,
        "total_mass_kg": 12.331,
        "mass_varies": false,
        "bbox_mm": {
          "x": 100.0,
          "y": 100.0,
          "z": 200.0
        },
        "volume_cm3": 1570.8,
        "area_cm2": 785.4,
        "density_g_cm3": 7.85,
        "density_assumed": true,
        "material_source": "default",
        "sheets": []
      }
    }
  ],
  "consumables": [],
  "relationships": [],
  "flags": {
    "from_3d_solids": true,
    "some_density_assumed": true,
    "material_sources": {
      "label": 0,
      "name_rule": 0,
      "default": 1
    }
  },
  "_note": "Nền tảng cho qtcn (--seed). est_mass_kg là KHỐI LƯỢNG THẬT từ solid 3D. VT gán tự động; drawing_no/consumables/relationships để trống (điền tay/gộp seed 2D)."
}