{
  "schema": "qtcn-seed/v1",
  "product": {"code": "TEST-01", "name": "fixture-inventor", "units": "mm", "principal_particulars": {}},
  "source": {"kind": "inventor-bom-export", "bom_file": "C:/x/BOM.xlsx"},
  "bom": [
    {
      "vt": "VT1", "drawing_no": "BM.01.01", "name": "Nẹp dọc", "qty": 4, "material": "Thép EH32",
      "specs": {"est_mass_kg": 3.93, "sections": [], "plate_mm": null, "tolerances": [], "key_dims": [], "sheets": []}
    },
    {
      "vt": "VT2", "drawing_no": "BM.01.02", "name": "Tấm đáy", "qty": 2, "material": "Thép EH32",
      "specs": {"est_mass_kg": 18.0, "sections": [], "plate_mm": "5", "tolerances": [], "key_dims": [], "sheets": []}
    },
    {
      "vt": "VT3", "drawing_no": "BM.01.03", "name": "Bích chân", "qty": 4, "material": "Thép EH32",
      "specs": {"est_mass_kg": 0.8, "sections": [], "plate_mm": "8", "tolerances": [], "key_dims": [], "sheets": []}
    }
  ],
  "consumables": [], "relationships": [],
  "flags": {"mass_source": "inventor", "mass_complete": true}
}
